Unknown_symbol,index_row,text
 ,2,"La farmacéutica estadounidense Pfizer no podrá producir las 100 millones de dosis de su vacuna contra el coronavirus para el final de este año, como tenía planeando, debido a obstáculos en la cadena de suministros, reporta The Wall Street Journal, al referirse a una fuente directamente involucrada en el desarrollo del fármaco. La compañía estadounidense, que elaboró la vacuna BNT162b junto con la alemana BioNTech, solo podrá preparar 50 millones de dosis en dicho período.""Algunos de los primeros lotes de materias primas no cumplieron con los estándares. Lo arreglamos, pero se nos acabó el tiempo para cumplir con los envíos proyectados para este año"", cita el medio a su fuente. Pfizer obtiene sus materias primas de proveedores en EE.UU. y Europa."
 ,3,"Cuatro voluntarios experimentaron una parálisis facial durante el ensayo de la vacuna contra el coronavirus desarrollada por Pfizer y BioNTech, según la Administración de Medicamentos y Alimentos de EE.UU. (FDA) ha confirmado en documentos informativos sobre los resultados de pruebas.La parálisis facial periférica idiopática, o parálisis de Bell, fue registrada temporalmente en cuatro pacientes que recibieron la vacuna. Es un síndrome que causa debilidad de la musculatura de la cara por la afectación del nervio facial. Además, no se conoce la causa que origina esta condición. Estos casos ocurrieron a 3, 9, 37 y 48 días después de la vacunación.Sin embargo, la FDA afirmó que la frecuencia de esta condición ""encaja con la tasa de antecedentes esperada en la población general"", y agregó que no había evidencia clara que vincule la vacuna coronavirus con esta condición médica. Ningún voluntario del grupo que recibió placebo experimentó la parálisis de Bell.Por precaución, la Administración de Medicamentos y Alimentos de EE.UU. ha recomendado realizar una ""vigilancia de los casos de parálisis de Bell al emplear la vacuna en poblaciones más numerosas""."
 ,4,"La farmacéutica estadounidense Pfizer y la alemana BioNTech han presentado este martes una solicitud de autorización de emergencia ante la Agencia Europea de Medicamentos (EMA) para poder distribuir y aplicar su vacuna contra el covid-19 BNT162b2 en el territorio de la Unión Europea, informa Reuters.La solicitud se hace un día después de que la compañía biotecnológica estadounidense Moderna anunciara que solicitará a la EMA el permiso para el uso de emergencia de su vacuna contra el coronavirus mRNA-1273 y enviara a la Administración de Alimentos y Medicamentos de EE.UU. (FDA) la misma solicitud."
 ,6,"La vacuna contra el covid-19 de la farmacéutica estadounidense Moderna hace que el sistema inmunológico humano produzca anticuerpos que duran al menos tres meses, según revelaron este jueves los investigadores del Instituto Nacional de Alergias y Enfermedades Infecciosas (NIAID), el cual participó en el desarrollo del fármaco, recoge AFP. Los científicos estudiaron la respuesta inmunitaria de 34 participantes adultos, tanto jóvenes como mayores, desde la primera fase de los ensayos clínicos y encontraron que los anticuerpos ""disminuyeron ligeramente con el tiempo, como se esperaba, pero permanecieron elevados en todos los participantes tres meses después de la [segunda] dosis"" del fármaco."
 ,7,"La vacuna rusa contra el coronavirus será la más asequible, en comparación con otros fármacos desarrollados contra el covid-19, ha anunciado este miércoles el director del Fondo Ruso de Inversión Directa (RDIF), Kiril Dmítriev, en el marco de la presentación detallada de la Sputnik V mediante una videoconferencia durante una sesión especial de la Asamblea General de la ONU.""El precio de la vacuna rusa contra el coronavirus Sputnik V será de menos de 10 dólares la dosis"", precisó Dmítriev y agregó que el fármaco ""estará disponible para otros países de cara a la vacunación masiva a partir del próximo año"".Más de 1.200 millones de dosis encargadas""Hablé de precio, de logística, y no es de extrañar que más de 40 países, que representan más del 50% de la población mundial, ya hayan encargado la vacuna Sputnik V. Hemos recibido pedidos de más de 1.200 millones de dosis. Trabajaremos en su producción en asociación con la India, China, Corea del Sur, Argentina y otros países"", dijo el director del RDIF."